{
  "$comment": "SPDX-License-Identifier: Apache-2.0",
  "$schema": "../schemas/0.2/profile.schema.json",
  "profileId": "FAST",
  "bpiVersion": "0.2.0-draft",
  "description": "For constrained sites where a 1350 m dead-man buffer is not available. Requires a co-located token issuer; the latency gate of [R-C-022] excludes any store-and-forward command path.",
  "tokenRefreshHz": 10,
  "tokenLifetimeS": 1,
  "consecutiveLossesTolerated": 9,
  "abortToSafeS": 0.32,
  "pointingLossToSafeMs": 200,
  "armLeadS": 120,
  "clearanceValidityS": 15,
  "acquireMaxS": 30,
  "rampUpMaxPercentPerS": 10,
  "holdS": 5,
  "probeLevelFractionOfPublicLimit": 0.01,
  "corridorHalfAngleDeg": 0.2,
  "rationale": {
    "tokenLifetimeS": "1000 + 100 + 50 + 250 = 1400 ms worst case, giving a 330 m buffer at 250 m/s. Buys a tighter site at the cost of requiring a command path with p99 latency under 333 ms per [R-C-022], which effectively means co-location.",
    "tokenRefreshHz": "10 Hz is inside the GEO round trip and this profile is therefore unsuitable for GEO."
  },
  "objections": [
    "O-2",
    "O-6"
  ]
}