{
  "$comment": "SPDX-License-Identifier: Apache-2.0",
  "$schema": "../schemas/0.2/profile.schema.json",
  "profileId": "RELAXED",
  "bpiVersion": "0.2.0-draft",
  "description": "Space-to-space delivery, where there is no ground keep-out volume and no human intruder to budget against. RESERVED: v0.1 is scoped to space-to-ground and this profile has not had a hazard analysis. See OBJECTIONS.md O-8.",
  "tokenRefreshHz": 0.2,
  "tokenLifetimeS": 30,
  "consecutiveLossesTolerated": 5,
  "abortToSafeS": 1.0,
  "pointingLossToSafeMs": 2000,
  "armLeadS": 300,
  "clearanceValidityS": 120,
  "acquireMaxS": 120,
  "rampUpMaxPercentPerS": 10,
  "holdS": 10,
  "probeLevelFractionOfPublicLimit": 0.01,
  "corridorHalfAngleDeg": 0.2,
  "rationale": {
    "tokenLifetimeS": "The intruder budget of [R-S-024] does not apply without a ground keep-out volume. The binding constraint for space-to-space is relative velocity against a cooperative receiver, which this document has not analysed. 30 s is a placeholder and is NOT derived.",
    "profileId": "Provided so the information model reserves the case. NOT usable at v0.1."
  },
  "objections": [
    "O-8"
  ]
}